Nom,URL,Type,Description,Données disponibles,Accès,Zone,Contenu
Private Equity International,https://www.privateequityinternational.com,Base de données,Intelligence et classements du private equity mondial,"Rankings fonds PE, deals, LPs, fundraising, analyses",Gratuit / Payant,Mondial,Fiches légales / Bilans financiers
SimilarWeb,https://www.similarweb.com,Intelligence économique,Données de trafic web et intelligence digitale,"Trafic web entreprises, parts de marché digitales, benchmarks, tendances",Gratuit / Payant,Mondial,Scoring / Risque
BuiltWith,https://builtwith.com,Intelligence économique,Profilage technologique des sites web d'entreprises,"Technologies utilisées, CMS, analytics, hébergement, e-commerce, tendances",Gratuit / Payant,Mondial,Scoring / Risque
Craft.co,https://craft.co,Base de données,Intelligence sur les entreprises privées et publiques,"Profils, données financières, employés, technologies, supply chain",Gratuit / Payant,Mondial,Fiches légales / Bilans financiers
Clearbit,https://clearbit.com,Intelligence économique,Enrichissement de données B2B et intelligence commerciale,"Profils entreprises, contacts, technographies, firmographics, intent data",Payant,Mondial,Scoring / Risque
Apollo.io,https://www.apollo.io,Intelligence économique,Plateforme de prospection B2B avec données de contacts,"Contacts professionnels, entreprises, emails, téléphones, enrichissement",Gratuit / Payant,Mondial,Scoring / Risque
RocketReach,https://rocketreach.co,Intelligence économique,Recherche de contacts professionnels et données entreprises,"Emails, téléphones, profils, entreprises, enrichissement CRM",Gratuit / Payant,Mondial,Scoring / Risque
Chambre d'Agriculture Pays de la Loire,https://pays-de-la-loire.chambres-agriculture.fr,Chambre consulaire,Chambre d'Agriculture des Pays de la Loire,"Annuaire exploitations, données agricoles, filières, accompagnement",Gratuit,Pays de la Loire,Annuaire
Chambre d'Agriculture Loire-Atlantique,https://loire-atlantique.chambres-agriculture.fr,Chambre consulaire,Chambre d'Agriculture de Loire-Atlantique,"Annuaire exploitations 44, données agricoles, filières, installation",Gratuit,Pays de la Loire,Annuaire
Chambre d'Agriculture Maine-et-Loire,https://maine-et-loire.chambres-agriculture.fr,Chambre consulaire,Chambre d'Agriculture du Maine-et-Loire,"Annuaire exploitations 49, données agricoles, viticulture, élevage",Gratuit,Pays de la Loire,Annuaire
Chambre d'Agriculture Vendée,https://vendee.chambres-agriculture.fr,Chambre consulaire,Chambre d'Agriculture de Vendée,"Annuaire exploitations 85, données agricoles, élevage, maraîchage",Gratuit,Pays de la Loire,Annuaire
Chambre d'Agriculture Sarthe,https://sarthe.chambres-agriculture.fr,Chambre consulaire,Chambre d'Agriculture de la Sarthe,"Annuaire exploitations 72, données agricoles, céréales, élevage",Gratuit,Pays de la Loire,Annuaire
Chambre d'Agriculture Mayenne,https://mayenne.chambres-agriculture.fr,Chambre consulaire,Chambre d'Agriculture de la Mayenne,"Annuaire exploitations 53, données agricoles, lait, élevage",Gratuit,Pays de la Loire,Annuaire
La Cité des Congrès Nantes - Business,https://www.lacite-nantes.fr,Portail thématique,Centre de congrès de Nantes - événements professionnels et salons,"Salons professionnels, congrès économiques, événements B2B, networking",Gratuit,Pays de la Loire,Études / Rapports
Entreprises et Découvertes Pays de la Loire,https://www.entreprisesetdecouverte.fr,Annuaire,Réseau de visites d'entreprises en Pays de la Loire,"Annuaire entreprises visitables, savoir-faire, tourisme industriel",Gratuit,Pays de la Loire,Annuaire
Atlantic 2.0,https://www.atlantic2.org,Réseau professionnel,Association de l'écosystème numérique nantais,"Annuaire entreprises numériques, startups, événements, communauté tech",Gratuit,Pays de la Loire,Annuaire
PLATO Pays de la Loire,https://www.plato-pdl.fr,Réseau professionnel,Programme de parrainage PME par des grands groupes,"Annuaire PME parrainées, grands groupes mentors, données accompagnement",Gratuit,Pays de la Loire,Annuaire
Chambre d'Agriculture Centre-Val de Loire,https://centre-val-de-loire.chambres-agriculture.fr,Chambre consulaire,Chambre d'Agriculture Régionale du Centre-Val de Loire,"Annuaire exploitations, données agricoles, grandes cultures, filières",Gratuit,Centre-Val de Loire,Annuaire
Chambre d'Agriculture Loiret,https://loiret.chambres-agriculture.fr,Chambre consulaire,Chambre d'Agriculture du Loiret,"Annuaire exploitations 45, données agricoles, céréales, betteraves",Gratuit,Centre-Val de Loire,Annuaire
Chambre d'Agriculture Indre-et-Loire,https://indre-et-loire.chambres-agriculture.fr,Chambre consulaire,Chambre d'Agriculture d'Indre-et-Loire,"Annuaire exploitations 37, données agricoles, viticulture, maraîchage",Gratuit,Centre-Val de Loire,Annuaire
Chambre d'Agriculture Cher,https://cher.chambres-agriculture.fr,Chambre consulaire,Chambre d'Agriculture du Cher,"Annuaire exploitations 18, données agricoles, céréales, élevage",Gratuit,Centre-Val de Loire,Annuaire
Chambre d'Agriculture Eure-et-Loir,https://eure-et-loir.chambres-agriculture.fr,Chambre consulaire,Chambre d'Agriculture d'Eure-et-Loir,"Annuaire exploitations 28, données agricoles, Beauce, céréales",Gratuit,Centre-Val de Loire,Annuaire
Chambre d'Agriculture Loir-et-Cher,https://loir-et-cher.chambres-agriculture.fr,Chambre consulaire,Chambre d'Agriculture du Loir-et-Cher,"Annuaire exploitations 41, données agricoles, viticulture, Sologne",Gratuit,Centre-Val de Loire,Annuaire
Chambre d'Agriculture Indre,https://indre.chambres-agriculture.fr,Chambre consulaire,Chambre d'Agriculture de l'Indre,"Annuaire exploitations 36, données agricoles, élevage, céréales",Gratuit,Centre-Val de Loire,Annuaire
Orléans Val de Loire Business,https://www.orleans-business.com,Agence de développement,Agence d'attractivité économique d'Orléans,"Implantation, filières pharma/cosmétique/logistique, zones d'activité",Gratuit,Centre-Val de Loire,Annuaire / Études / Rapports
Pôle de compétitivité Elastopôle,https://www.elastopole.com,Pôle de compétitivité,Pôle de compétitivité du caoutchouc et des polymères (Tours/Orléans),"Annuaire membres, projets R&D caoutchouc, polymères, élastomères",Gratuit,Centre-Val de Loire,Annuaire
Polepharma,https://www.polepharma.com,Cluster,Cluster pharmaceutique du Centre-Val de Loire et Île-de-France,"Annuaire entreprises pharma, sous-traitants, façonniers, données filière",Gratuit,Centre-Val de Loire,Annuaire
MEDEF 37,https://www.medef37.fr,Syndicat patronal,MEDEF Touraine - organisation patronale locale,"Annuaire entreprises adhérentes, événements, réseau, services",Gratuit,Centre-Val de Loire,Annuaire / Études / Rapports
MEDEF 45,https://www.medef45.fr,Syndicat patronal,MEDEF Loiret - organisation patronale locale,"Annuaire entreprises adhérentes, événements, réseau, services",Gratuit,Centre-Val de Loire,Annuaire / Études / Rapports
CPME Centre-Val de Loire,https://www.cpme-cvl.fr,Syndicat patronal,CPME Centre-Val de Loire - organisation patronale PME,"Annuaire PME adhérentes, événements, services, accompagnement",Gratuit,Centre-Val de Loire,Annuaire / Études / Rapports
MEDEF Pays de la Loire,https://www.medefpaysdelaloire.fr,Syndicat patronal,MEDEF Pays de la Loire - organisation patronale régionale,"Annuaire entreprises adhérentes, événements, réseau, lobbying régional",Gratuit,Pays de la Loire,Annuaire / Études / Rapports
CPME Pays de la Loire,https://www.cpme-pdl.fr,Syndicat patronal,CPME Pays de la Loire - organisation patronale PME,"Annuaire PME adhérentes, événements, services, accompagnement",Gratuit,Pays de la Loire,Annuaire / Études / Rapports
Confédération Nationale de la Boulangerie-Pâtisserie,https://www.boulangerie.org,Fédération professionnelle,Fédération nationale des artisans boulangers-pâtissiers,"Annuaire boulangeries, données filière, formation, réglementation",Gratuit,France,Annuaire / Études / Rapports
CNPA (Conseil National des Professions de l'Automobile),https://www.cnpa.fr,Fédération professionnelle,Organisation professionnelle des services de l'automobile,"Annuaire garages/concessionnaires, données filière auto, services",Gratuit,France,Annuaire / Études / Rapports
Fédération du Commerce et de la Distribution (FCD),https://www.fcd.fr,Fédération professionnelle,Fédération de la grande distribution alimentaire,"Annuaire enseignes, données consommation, emploi, distribution",Gratuit,France,Annuaire / Études / Rapports
CDF (Conseil des Vins de France),https://www.intervin.fr,Fédération professionnelle,Organisation interprofessionnelle des vins de France,"Annuaire vignerons/négociants, appellations, données production, export",Gratuit,France,Annuaire / Études / Rapports
FNB (Fédération Nationale du Bois),https://www.fnbois.com,Fédération professionnelle,Fédération Nationale du Bois,"Annuaire entreprises bois, scieries, négoce, données filière forêt-bois",Gratuit,France,Annuaire / Études / Rapports
FNCPC (Fédération Nationale des Coopératives de Production),https://www.les-scop.coop,Fédération professionnelle,Fédération des Sociétés Coopératives et Participatives (SCOP/SCIC),"Annuaire SCOP/SCIC, données coopératives, emploi, chiffres clés ESS",Gratuit,France,Annuaire / Études / Rapports
CNAMS,https://cnams.fr,Fédération professionnelle,Confédération Nationale de l'Artisanat des Métiers et des Services,"Annuaire artisans adhérents, données artisanat de services, formation",Gratuit,France,Annuaire / Études / Rapports
Fédération des Industries Nautiques (FIN),https://www.fin.fr,Fédération professionnelle,Fédération des Industries Nautiques,"Annuaire constructeurs/équipementiers nautiques, données filière, salons",Gratuit,France,Annuaire / Études / Rapports
SNEF (Syndicat National de l'Édition Phonographique),https://www.snepmusique.com,Fédération professionnelle,Syndicat National de l'Édition Phonographique,"Données marché musique, labels, artistes, classements, certifications",Gratuit,France,Annuaire / Études / Rapports
Ordre National des Pédicures-Podologues,https://www.onpp.fr,Ordre professionnel,Annuaire officiel des pédicures-podologues,"Annuaire praticiens, spécialisations, coordonnées",Gratuit,France,Annuaire
Ordre National des Diététiciens,https://www.afdn.org,Ordre professionnel,Association Française des Diététiciens Nutritionnistes,"Annuaire diététiciens, spécialisations, coordonnées",Gratuit,France,Annuaire
Conseil National des Barreaux - Avocat.fr,https://www.avocat.fr,Ordre professionnel,Portail officiel de la profession d'avocat en France,"Annuaire avocats, consultations en ligne, tarifs, spécialisations",Gratuit,France,Annuaire
APCE - Agence France Entrepreneur,https://www.afecreation.fr,Portail institutionnel,Portail de la création d'entreprise en France,"Guides création, données statistiques, études, secteurs porteurs",Gratuit,France,Statistiques
Pôle Emploi - Statistiques IMT,https://www.pole-emploi.fr/employeur/informations-sur-le-marche-du-travail,Open data,Informations sur le Marché du Travail par Pôle Emploi,"Métiers en tension, bassins d'emploi, offres, candidats, secteurs",Gratuit,France,Open data / API
Acoss Stat,https://www.acoss.fr/home/observatoire-economique.html,Open data,Observatoire économique de l'ACOSS (URSSAF nationale),"Données emploi salarié privé, masse salariale, créations, défaillances",Gratuit,France,Open data / API
Ministère de la Culture - Entreprises culturelles,https://www.culture.gouv.fr/Thematiques/Etudes-et-statistiques,Open data,Statistiques du Ministère de la Culture sur les industries culturelles,"Données entreprises culturelles, édition, cinéma, spectacle, patrimoine",Gratuit,France,Statistiques
OPIIEC,https://www.opiiec.fr,Open data,Observatoire des métiers du numérique de l'ingénierie et du conseil,"Données emploi numérique/conseil, métiers, formations, tendances, salaires",Gratuit,France,Open data / API
EDF Open Data,https://opendata.edf.fr,Open data,Données ouvertes du groupe EDF,"Production électrique, consommation, installations, données territoriales",Gratuit,France,Open data / API
SNCF Open Data,https://data.sncf.com,Open data,Données ouvertes du groupe SNCF,"Gares, lignes, fréquentation, ponctualité, entreprises ferroviaires",Gratuit,France,Open data / API
Transport.data.gouv.fr,https://transport.data.gouv.fr,Open data,Point d'accès national aux données de transport,"Données transport, mobilité, infrastructures, opérateurs, temps réel",Gratuit,France,Open data / API
geo.data.gouv.fr,https://geo.data.gouv.fr,Open data,Données géographiques ouvertes de la France,"Zones d'activité, parcelles, bâtiments, adresses, données territoriales",Gratuit,France,Open data / API
DataViz DGFiP,https://data.economie.gouv.fr/pages/donnees-de-reference,Open data,Données de référence de la Direction Générale des Finances Publiques,"Impôt sur les sociétés, TVA, données fiscales entreprises par territoire",Gratuit,France,Open data / API
Tribunal de Commerce - données,https://www.infogreffe.fr/societes/statistiques,Base de données,Statistiques des Tribunaux de Commerce via Infogreffe,"Créations, radiations, procédures collectives, redressements, liquidations",Gratuit,France,Fiches légales / Bilans financiers
Agence Bio,https://www.agencebio.org,Portail institutionnel,Agence Française pour le Développement et la Promotion de l'Agriculture Biologique,"Annuaire producteurs bio, données agriculture bio, certifications, chiffres",Gratuit,France,Études / Rapports
Label Rouge,https://www.labelrouge.fr,Portail institutionnel,Site officiel du Label Rouge - produits de qualité supérieure,"Annuaire producteurs Label Rouge, cahiers des charges, produits, filières",Gratuit,France,Normes / Certifications
INAO (Institut National de l'Origine et de la Qualité),https://www.inao.gouv.fr,Portail institutionnel,Institut officiel des signes de qualité (AOC/AOP/IGP),"Annuaire appellations, organismes certificateurs, cahiers des charges",Gratuit,France,Études / Rapports
Cluster Maritime Français,https://www.cluster-maritime.fr,Cluster,Cluster de l'économie maritime française,"Annuaire entreprises maritimes, données économie bleue, filières mer",Gratuit,France,Annuaire
Pôle Nuclear Valley,https://www.nuclearvalley.com,Pôle de compétitivité,Pôle de compétitivité de la filière nucléaire (Auvergne),"Annuaire membres, projets nucléaire civil, maintenance, démantèlement",Gratuit,Auvergne-Rhône-Alpes,Annuaire
Outdoor Sports Valley,https://www.outdoorsportsvalley.org,Cluster,Cluster des sports outdoor en Auvergne-Rhône-Alpes,"Annuaire marques outdoor, équipementiers, données filière sport/montagne",Gratuit,Auvergne-Rhône-Alpes,Annuaire
Plastipolis,https://www.plastipolis.fr,Pôle de compétitivité,Pôle de compétitivité de la plasturgie (Oyonnax/AURA),"Annuaire membres, projets plasturgie, composites, recyclage plastiques",Gratuit,Auvergne-Rhône-Alpes,Annuaire
Lyon Urban Truck & Bus,https://www.lutb-aeai.org,Cluster,Cluster transport urbain et interurbain en AURA,"Annuaire entreprises transport, bus/camions, mobilité urbaine, hydrogène",Gratuit,Auvergne-Rhône-Alpes,Annuaire
Grenoble-Alpes Métropole Éco,https://www.grenoblealpesmetropole.fr/economie,Agence de développement,Développement économique de Grenoble-Alpes Métropole,"Implantation, micro-nano, numérique, énergie, zones d'activité, données",Gratuit,Auvergne-Rhône-Alpes,Annuaire / Études / Rapports
Saint-Étienne Métropole Éco,https://www.saint-etienne-metropole.fr/economie,Agence de développement,Développement économique de Saint-Étienne Métropole,"Implantation, design, industrie, zones d'activité, données territoire",Gratuit,Auvergne-Rhône-Alpes,Annuaire / Études / Rapports
French Tech Saint-Étienne,https://lafrenchtech.com/fr/la-france-a-lechelon-local/saint-etienne,Écosystème startup,Communauté French Tech de Saint-Étienne,"Annuaire startups, événements, design, industrie créative",Gratuit,Auvergne-Rhône-Alpes,Annuaire
MINALOGIC Grenoble,https://www.minalogic.com/annuaire,Annuaire B2B,Annuaire des membres du pôle Minalogic,"Entreprises deep tech, micro-nano, logiciel, photonique, profils détaillés",Gratuit,Auvergne-Rhône-Alpes,Annuaire
Imaginove,https://www.imaginove.fr,Cluster,Cluster des industries créatives et du jeu vidéo en AURA,"Annuaire studios jeux vidéo, animation, VFX, réalité virtuelle",Gratuit,Auvergne-Rhône-Alpes,Annuaire
ID4CAR Bretagne,https://www.id4car.fr/annuaire,Annuaire B2B,Annuaire du cluster automobile et mobilités du Grand Ouest,"Entreprises automobile, sous-traitance, équipementiers, profils",Gratuit,Bretagne,Annuaire
Produit en Bretagne,https://www.produitenbretagne.bzh,Réseau professionnel,Marque collective et réseau d'entreprises bretonnes,"Annuaire 500+ entreprises, produits bretons, marque, emploi local",Gratuit,Bretagne,Annuaire
Breizh Small Business Act,https://www.bretagne.bzh/aides,Portail subventions,Portail des aides régionales de Bretagne aux entreprises,"Aides régionales, subventions, prêts, dispositifs, critères d'éligibilité",Gratuit,Bretagne,Subventions / Aides
Pôle Cristal (agroalimentaire),https://www.pole-cristal.fr,Pôle de compétitivité,Pôle de compétitivité agroalimentaire de Bretagne,"Annuaire membres, froid/congélation, projets R&D agro, innovation",Gratuit,Bretagne,Annuaire
Photonics Bretagne,https://www.photonics-bretagne.com,Cluster,Cluster photonique et fibres optiques en Bretagne,"Annuaire entreprises photonique, fibres, capteurs, télécoms",Gratuit,Bretagne,Annuaire
CCI Pau Béarn,https://www.pau.cci.fr,Chambre consulaire,CCI territoriale de Pau Béarn,"Annuaire entreprises, formalités, accompagnement, données économiques 64",Gratuit,Nouvelle-Aquitaine,Annuaire
CCI Limoges Haute-Vienne,https://www.limoges.cci.fr,Chambre consulaire,CCI territoriale de Limoges et de la Haute-Vienne,"Annuaire entreprises, formalités, accompagnement, données économiques 87",Gratuit,Nouvelle-Aquitaine,Annuaire
Pôle Xylofutur,https://www.xylofutur.fr,Pôle de compétitivité,Pôle de compétitivité bois et matériaux biosourcés (Aquitaine),"Annuaire membres, projets bois construction, forêt, bioéconomie",Gratuit,Nouvelle-Aquitaine,Annuaire
Pôle Alpha RLH,https://www.pole-alpha-rlh.com,Pôle de compétitivité,Pôle de compétitivité Route des Lasers et Hautes technologies (Aquitaine),"Annuaire membres, projets photonique, laser, spatial, défense",Gratuit,Nouvelle-Aquitaine,Annuaire
Pôle AVENIA,https://www.pole-avenia.com,Pôle de compétitivité,Pôle de compétitivité géosciences et énergies du sous-sol,"Annuaire membres, projets géothermie, stockage CO2, hydrogène, mines",Gratuit,Nouvelle-Aquitaine,Annuaire
French Tech Limousin,https://lafrenchtech.com/fr/la-france-a-lechelon-local/limousin,Écosystème startup,Communauté French Tech du Limousin,"Annuaire startups, événements, céramique/numérique, communauté",Gratuit,Nouvelle-Aquitaine,Annuaire
Pépinière éco-créative (Angoulême),https://www.magelis.org,Incubateur,Magelis - pôle Image d'Angoulême (jeux vidéo/animation/BD),"Annuaire studios, entreprises image/animation, données filière créative",Gratuit,Nouvelle-Aquitaine,Annuaire
Aérocampus Aquitaine,https://aerocampus-aquitaine.com,Cluster,Campus et cluster aéronautique d'Aquitaine,"Annuaire entreprises aéro, formation, MRO, données filière aéronautique",Gratuit,Nouvelle-Aquitaine,Annuaire
French Tech La Rochelle,https://lafrenchtech.com/fr/la-france-a-lechelon-local/la-rochelle,Écosystème startup,Communauté French Tech de La Rochelle,"Annuaire startups, écologie/nautisme/numérique, événements",Gratuit,Nouvelle-Aquitaine,Annuaire
CCI Aude,https://www.aude.cci.fr,Chambre consulaire,CCI territoriale de l'Aude (Carcassonne/Narbonne),"Annuaire entreprises, formalités, accompagnement, données économiques 11",Gratuit,Occitanie,Annuaire
CCI Tarn,https://www.tarn.cci.fr,Chambre consulaire,CCI territoriale du Tarn (Albi/Castres),"Annuaire entreprises, formalités, accompagnement, données économiques 81",Gratuit,Occitanie,Annuaire
CCI Lot,https://www.lot.cci.fr,Chambre consulaire,CCI territoriale du Lot (Cahors),"Annuaire entreprises, formalités, accompagnement, données économiques 46",Gratuit,Occitanie,Annuaire
Pôle Derbi,https://www.pole-derbi.com,Pôle de compétitivité,Pôle de compétitivité énergies renouvelables et bâtiment durable (Perpignan),"Annuaire membres, projets solaire, éolien, bâtiment intelligent, ENR",Gratuit,Occitanie,Annuaire
Pôle Eurobiomed,https://www.eurobiomed.org,Pôle de compétitivité,Pôle de compétitivité santé en Occitanie et PACA,"Annuaire membres, projets biotech, medtech, pharma, santé numérique",Gratuit,Occitanie,Annuaire
Toulouse White Biotechnologies,https://www.toulouse-white-biotechnologies.com,Cluster,Cluster des biotechnologies industrielles à Toulouse,"Annuaire entreprises biotech, chimie verte, bioénergie, projets R&D",Gratuit,Occitanie,Annuaire
French Tech Perpignan,https://lafrenchtech.com/fr/la-france-a-lechelon-local/perpignan,Écosystème startup,Communauté French Tech de Perpignan Méditerranée,"Annuaire startups, solaire/agriculture/tourisme tech, événements",Gratuit,Occitanie,Annuaire
IoT Valley Toulouse,https://www.iot-valley.fr,Incubateur,Accélérateur dédié à l'Internet des Objets à Toulouse,"Annuaire startups IoT, capteurs, IA embarquée, smart city, industrie 4.0",Gratuit,Occitanie,Annuaire
CCI Le Havre,https://www.havre.cci.fr,Chambre consulaire,CCI territoriale du Havre,"Annuaire entreprises, formalités, accompagnement, port/logistique 76",Gratuit,Normandie,Annuaire
CCI Orne,https://www.orne.cci.fr,Chambre consulaire,CCI territoriale de l'Orne,"Annuaire entreprises, formalités, accompagnement, données économiques 61",Gratuit,Normandie,Annuaire
CCI Manche,https://www.manche.cci.fr,Chambre consulaire,CCI territoriale de la Manche (Cherbourg/Saint-Lô),"Annuaire entreprises, formalités, accompagnement, données économiques 50",Gratuit,Normandie,Annuaire
Pôle Novalog,https://www.novalog.eu,Pôle de compétitivité,Pôle de compétitivité logistique et supply chain (Le Havre/Normandie),"Annuaire membres, projets logistique, portuaire, supply chain, digital",Gratuit,Normandie,Annuaire
NAE (Normandie AeroEspace),https://www.nae.fr,Cluster,Cluster aéronautique et spatial de Normandie,"Annuaire entreprises aéro/spatial, MRO, sous-traitance, données filière",Gratuit,Normandie,Annuaire
French Tech Caen Normandie,https://lafrenchtech.com/fr/la-france-a-lechelon-local/caen,Écosystème startup,Communauté French Tech de Caen Normandie,"Annuaire startups, cybersécurité, santé numérique, événements",Gratuit,Normandie,Annuaire
CCI Bouches-du-Rhône,https://www.ccimp.com/annuaire,Annuaire B2B,Annuaire des entreprises de la CCI Marseille-Provence,"Entreprises par secteur/taille, données CCI, coordonnées",Gratuit,Provence-Alpes-Côte d'Azur,Annuaire
Team Côte d'Azur,https://www.teamcotedazur.fr,Agence de développement,Agence de développement économique de Nice Côte d'Azur,"Implantation, IA, tourisme, smart city, zones d'activité, données Nice",Gratuit,Provence-Alpes-Côte d'Azur,Annuaire / Études / Rapports
Aix-Marseille Provence Attractivité,https://www.investinprovence.com,Agence de développement,Agence d'attractivité économique d'Aix-Marseille-Provence,"Implantation, filières mer/énergie/numérique/santé, données territoire",Gratuit,Provence-Alpes-Côte d'Azur,Annuaire / Études / Rapports
Pôle PASS (Parfums Arômes Senteurs Saveurs),https://www.pole-pass.fr,Pôle de compétitivité,Pôle de compétitivité parfumerie et arômes (Grasse),"Annuaire membres, projets parfumerie, cosmétique, arômes, Grasse",Gratuit,Provence-Alpes-Côte d'Azur,Annuaire
Toulon Var Technologies,https://www.tvt.fr,Technopole,Technopole Toulon Var Technologies,"Annuaire entreprises innovantes Var, mer, défense, numérique, santé",Gratuit,Provence-Alpes-Côte d'Azur,Annuaire
CCI Bas-Rhin,https://www.alsace-eurometropole.cci.fr/bas-rhin,Chambre consulaire,CCI territoriale du Bas-Rhin complémentaire,"Annuaire entreprises, formalités, données économiques 67 complémentaires",Gratuit,Grand Est,Annuaire
CCI Haut-Rhin,https://www.alsace.cci.fr/haut-rhin,Chambre consulaire,CCI territoriale du Haut-Rhin (Mulhouse/Colmar),"Annuaire entreprises, formalités, accompagnement, données économiques 68",Gratuit,Grand Est,Annuaire
Alsace Innovation,https://www.alsaceinnovation.eu,Incubateur,Incubateur et accélérateur de startups en Alsace,"Annuaire startups incubées, programmes, projets innovants, FabLab",Gratuit,Grand Est,Annuaire
Pôle Hydreos,https://www.hydreos.fr,Pôle de compétitivité,Pôle de compétitivité eau et environnement (Grand Est),"Annuaire membres, projets eau, assainissement, environnement, milieux",Gratuit,Grand Est,Annuaire
French Tech Nancy,https://lafrenchtech.com/fr/la-france-a-lechelon-local/nancy,Écosystème startup,Communauté French Tech de Nancy,"Annuaire startups, santé numérique, IA, matériaux, communauté",Gratuit,Grand Est,Annuaire
SEMIA (Alsace),https://www.semia.fr,Incubateur,Incubateur d'entreprises innovantes d'Alsace,"Annuaire startups incubées, biotech, medtech, numérique, deep tech",Gratuit,Grand Est,Annuaire
Pôle Alsace Energivie,https://www.alsace-energivie.fr,Cluster,Cluster efficacité énergétique et construction durable en Alsace,"Annuaire entreprises, bâtiment passif, rénovation, ENR, smart building",Gratuit,Grand Est,Annuaire
