Nom,URL,Type,Description,Données disponibles,Accès,Zone,Contenu
CCI Gironde,https://www.bordeauxgironde.cci.fr,Chambre consulaire,CCI territoriale de Bordeaux Gironde,"Annuaire entreprises, formalités, accompagnement, données économiques 33",Gratuit,Nouvelle-Aquitaine,Annuaire
CCI Pyrénées-Atlantiques,https://www.bayonne.cci.fr,Chambre consulaire,CCI territoriale Bayonne Pays Basque,"Annuaire entreprises, formalités, accompagnement, données économiques 64",Gratuit,Nouvelle-Aquitaine,Annuaire
CCI Charente-Maritime,https://www.larochelle.cci.fr,Chambre consulaire,CCI territoriale de La Rochelle,"Annuaire entreprises, formalités, accompagnement, données économiques 17",Gratuit,Nouvelle-Aquitaine,Annuaire
CCI Vienne,https://www.poitiers.cci.fr,Chambre consulaire,CCI territoriale de la Vienne,"Annuaire entreprises, formalités, accompagnement, données économiques 86",Gratuit,Nouvelle-Aquitaine,Annuaire
CCI Dordogne,https://www.dordogne.cci.fr,Chambre consulaire,CCI territoriale de Dordogne,"Annuaire entreprises, formalités, accompagnement, données économiques 24",Gratuit,Nouvelle-Aquitaine,Annuaire
CMA Nouvelle-Aquitaine,https://www.cma-nouvelle-aquitaine.fr,Chambre consulaire,Chambre de Métiers et de l'Artisanat de Nouvelle-Aquitaine,"Annuaire artisans, accompagnement, apprentissage, données artisanat régional",Gratuit,Nouvelle-Aquitaine,Annuaire
ADI Nouvelle-Aquitaine,https://www.adi-na.fr,Agence de développement,Agence de Développement et d'Innovation de Nouvelle-Aquitaine,"Implantation, innovation, filières stratégiques, accompagnement export, données éco",Gratuit,Nouvelle-Aquitaine,Annuaire / Études / Rapports
Bordeaux Métropole Attractivité,https://www.invest-in-bordeaux.com,Agence de développement,Agence d'attractivité économique de Bordeaux Métropole,"Implantation, filières vin/aéro/numérique, zones d'activité, données territoire",Gratuit,Nouvelle-Aquitaine,Annuaire / Études / Rapports
French Tech Bordeaux,https://lafrenchtech.com/fr/la-france-a-lechelon-local/bordeaux,Écosystème startup,Communauté French Tech de Bordeaux,"Annuaire startups, événements, programmes, écosystème numérique bordelais",Gratuit,Nouvelle-Aquitaine,Annuaire
Technopole Bordeaux Technowest,https://www.technowest.com,Technopole,Technopole de Bordeaux - accompagnement startups et innovation,"Annuaire entreprises incubées, programmes d'accélération, projets innovants",Gratuit,Nouvelle-Aquitaine,Annuaire
Pôle Aerospace Valley,https://www.aerospace-valley.com,Pôle de compétitivité,Pôle de compétitivité aéronautique espace et systèmes embarqués (Bordeaux/Toulouse),"Annuaire membres, projets R&D aéro, spatial, drones, systèmes embarqués",Gratuit,Nouvelle-Aquitaine,Annuaire
Route des Lasers,https://www.routedeslasers.com,Cluster,Cluster optique et laser en Aquitaine,"Annuaire entreprises photonique, laser, optique, projets R&D",Gratuit,Nouvelle-Aquitaine,Annuaire
CRESS Nouvelle-Aquitaine,https://cressna.org,Réseau ESS,Chambre Régionale de l'Économie Sociale et Solidaire de Nouvelle-Aquitaine,"Annuaire structures ESS, observatoire, emploi ESS, cartographie",Gratuit,Nouvelle-Aquitaine,Annuaire
CCI Haute-Garonne,https://www.toulouse.cci.fr,Chambre consulaire,CCI territoriale de Toulouse Haute-Garonne,"Annuaire entreprises, formalités, accompagnement, données économiques 31",Gratuit,Occitanie,Annuaire
CCI Hérault,https://www.herault.cci.fr,Chambre consulaire,CCI territoriale de l'Hérault (Montpellier),"Annuaire entreprises, formalités, accompagnement, données économiques 34",Gratuit,Occitanie,Annuaire
CCI Gard,https://www.nimes.cci.fr,Chambre consulaire,CCI territoriale du Gard (Nîmes),"Annuaire entreprises, formalités, accompagnement, données économiques 30",Gratuit,Occitanie,Annuaire
CCI Pyrénées-Orientales,https://www.perpignan.cci.fr,Chambre consulaire,CCI territoriale des Pyrénées-Orientales,"Annuaire entreprises, formalités, accompagnement, données économiques 66",Gratuit,Occitanie,Annuaire
CMA Occitanie,https://www.cma-occitanie.fr,Chambre consulaire,Chambre de Métiers et de l'Artisanat d'Occitanie,"Annuaire artisans, accompagnement, apprentissage, données artisanat régional",Gratuit,Occitanie,Annuaire
AD'OCC,https://www.agence-adocc.com,Agence de développement,Agence de développement économique de la Région Occitanie,"Implantation, filières aéro/santé/numérique/agri, innovation, export, données éco",Gratuit,Occitanie,Annuaire / Études / Rapports
French Tech Toulouse,https://lafrenchtech.com/fr/la-france-a-lechelon-local/toulouse,Écosystème startup,Communauté French Tech de Toulouse,"Annuaire startups, événements, programmes, écosystème aéro/spatial/numérique",Gratuit,Occitanie,Annuaire
French Tech Montpellier,https://lafrenchtech.com/fr/la-france-a-lechelon-local/montpellier,Écosystème startup,Communauté French Tech de Montpellier Méditerranée,"Annuaire startups, événements, HealthTech, AgriTech, numérique",Gratuit,Occitanie,Annuaire
Toulouse Métropole Économie,https://www.toulouse-metropole.fr/economie,Agence de développement,Développement économique de Toulouse Métropole,"Implantation, filières aéro/spatial, zones d'activité, données territoire",Gratuit,Occitanie,Annuaire / Études / Rapports
BIC de Montpellier,https://www.bfrp.fr,Incubateur,Business Innovation Centre de Montpellier Méditerranée,"Annuaire entreprises incubées, programmes, projets innovants",Gratuit,Occitanie,Annuaire
Cancer Bio Santé,https://www.cancerbiosante.fr,Pôle de compétitivité,Pôle de compétitivité en onco-pharmacologie (Toulouse),"Annuaire membres, projets R&D cancer, pharma, biotech",Gratuit,Occitanie,Annuaire
Agri Sud-Ouest Innovation,https://www.agrisudouest.com,Pôle de compétitivité,Pôle de compétitivité agriculture et agroalimentaire du Sud-Ouest,"Annuaire membres, projets R&D agricole, viticulture, transformation",Gratuit,Occitanie,ESG / RSE
Water Occitanie,https://www.water-occitanie.fr,Cluster,Cluster de la filière eau en Occitanie,"Annuaire entreprises eau, assainissement, irrigation, projets",Gratuit,Occitanie,Annuaire
CRESS Occitanie,https://www.cressoccitanie.org,Réseau ESS,Chambre Régionale de l'Économie Sociale et Solidaire d'Occitanie,"Annuaire structures ESS, observatoire, emploi ESS, cartographie",Gratuit,Occitanie,Annuaire
Robotics Place,https://www.robotics-place.com,Cluster,Cluster robotique et systèmes intelligents d'Occitanie,"Annuaire entreprises robotique, drones, cobotique, IA embarquée",Gratuit,Occitanie,Annuaire
CCI Lyon Métropole,https://www.lyon-metropole.cci.fr,Chambre consulaire,CCI territoriale de Lyon Métropole Saint-Étienne Roanne,"Annuaire entreprises, formalités, accompagnement, données économiques 69",Gratuit,Auvergne-Rhône-Alpes,Annuaire
CCI Grenoble,https://www.grenoble.cci.fr,Chambre consulaire,CCI territoriale de Grenoble,"Annuaire entreprises, formalités, accompagnement, données économiques 38",Gratuit,Auvergne-Rhône-Alpes,Annuaire
CCI Puy-de-Dôme,https://www.clermont-ferrand.cci.fr,Chambre consulaire,CCI territoriale du Puy-de-Dôme (Clermont-Ferrand),"Annuaire entreprises, formalités, accompagnement, données économiques 63",Gratuit,Auvergne-Rhône-Alpes,Annuaire
CCI Savoie,https://www.savoie.cci.fr,Chambre consulaire,CCI territoriale de la Savoie,"Annuaire entreprises, formalités, accompagnement, données économiques 73",Gratuit,Auvergne-Rhône-Alpes,Annuaire
CCI Haute-Savoie,https://www.haute-savoie.cci.fr,Chambre consulaire,CCI territoriale de Haute-Savoie,"Annuaire entreprises, formalités, accompagnement, données économiques 74",Gratuit,Auvergne-Rhône-Alpes,Annuaire
CCI Drôme,https://www.drome.cci.fr,Chambre consulaire,CCI territoriale de la Drôme,"Annuaire entreprises, formalités, accompagnement, données économiques 26",Gratuit,Auvergne-Rhône-Alpes,Annuaire
CCI Ain,https://www.ain.cci.fr,Chambre consulaire,CCI territoriale de l'Ain,"Annuaire entreprises, formalités, accompagnement, données économiques 01",Gratuit,Auvergne-Rhône-Alpes,Annuaire
CMA Auvergne-Rhône-Alpes,https://www.cma-auvergnerhonealpes.fr,Chambre consulaire,Chambre de Métiers et de l'Artisanat d'Auvergne-Rhône-Alpes,"Annuaire artisans, accompagnement, apprentissage, données artisanat régional",Gratuit,Auvergne-Rhône-Alpes,Annuaire
Auvergne-Rhône-Alpes Entreprises,https://www.auvergnerhonealpes-entreprises.fr,Agence de développement,Agence régionale de développement économique d'AURA,"Implantation, filières stratégiques, innovation, export, données économiques",Gratuit,Auvergne-Rhône-Alpes,Annuaire / Études / Rapports
ADERLY Lyon,https://www.aderly.com,Agence de développement,Agence de développement économique de la région lyonnaise,"Implantation, filières santé/chimie/numérique, zones d'activité, données Lyon",Gratuit,Auvergne-Rhône-Alpes,Annuaire / Études / Rapports
French Tech Lyon,https://lafrenchtech.com/fr/la-france-a-lechelon-local/lyon,Écosystème startup,Communauté French Tech de Lyon,"Annuaire startups, événements, HealthTech, DeepTech, communauté",Gratuit,Auvergne-Rhône-Alpes,Annuaire
French Tech in the Alps (Grenoble),https://lafrenchtech.com/fr/la-france-a-lechelon-local/in-the-alps,Écosystème startup,Communauté French Tech in the Alps - Grenoble/Annecy/Chambéry,"Annuaire startups, deep tech, semi-conducteurs, outdoor, communauté alpine",Gratuit,Auvergne-Rhône-Alpes,Annuaire
Minalogic,https://www.minalogic.com,Pôle de compétitivité,Pôle de compétitivité du numérique à Grenoble,"Annuaire membres, micro-nanoélectronique, logiciel, photonique, projets R&D",Gratuit,Auvergne-Rhône-Alpes,Annuaire
Lyonbiopôle,https://www.lyonbiopole.com,Pôle de compétitivité,Pôle de compétitivité en santé à Lyon,"Annuaire membres, projets R&D santé, diagnostic, dispositifs médicaux, vaccins",Gratuit,Auvergne-Rhône-Alpes,Annuaire
Axelera,https://www.axelera.org,Pôle de compétitivité,Pôle de compétitivité chimie et environnement à Lyon,"Annuaire membres, projets chimie verte, matériaux, recyclage",Gratuit,Auvergne-Rhône-Alpes,Annuaire
Techtera,https://www.techtera.org,Pôle de compétitivité,Pôle de compétitivité des textiles techniques en AURA,"Annuaire membres, textiles innovants, composites, smart textiles",Gratuit,Auvergne-Rhône-Alpes,Annuaire
Tenerrdis,https://www.tenerrdis.fr,Pôle de compétitivité,Pôle de compétitivité de la transition énergétique (Grenoble),"Annuaire membres, projets EnR, hydrogène, stockage, smart grids",Gratuit,Auvergne-Rhône-Alpes,Annuaire
CRESS Auvergne-Rhône-Alpes,https://www.cress-aura.org,Réseau ESS,Chambre Régionale de l'Économie Sociale et Solidaire d'AURA,"Annuaire structures ESS, observatoire, emploi ESS, cartographie",Gratuit,Auvergne-Rhône-Alpes,Annuaire
Clermont Auvergne Innovation,https://www.clermontauvergneinnovation.com,Technopole,Technopole de Clermont-Ferrand - innovation et accompagnement startups,"Annuaire entreprises innovantes, incubation, accélération, projets R&D",Gratuit,Auvergne-Rhône-Alpes,Annuaire
CCI Nord de France,https://www.hautsdefrance.cci.fr/cci-de-region,Chambre consulaire,CCI territoriale du Nord (Lille),"Annuaire entreprises, formalités, accompagnement, données économiques 59",Gratuit,Hauts-de-France,Annuaire
CCI Pas-de-Calais,https://www.artois.cci.fr,Chambre consulaire,CCI territoriale Artois (Pas-de-Calais),"Annuaire entreprises, formalités, accompagnement, données économiques 62",Gratuit,Hauts-de-France,Annuaire
CCI Aisne,https://www.aisne.cci.fr,Chambre consulaire,CCI territoriale de l'Aisne,"Annuaire entreprises, formalités, accompagnement, données économiques 02",Gratuit,Hauts-de-France,Annuaire
CCI Oise,https://www.oise.cci.fr,Chambre consulaire,CCI territoriale de l'Oise,"Annuaire entreprises, formalités, accompagnement, données économiques 60",Gratuit,Hauts-de-France,Annuaire
CCI Somme,https://www.somme.cci.fr,Chambre consulaire,CCI territoriale de la Somme (Amiens),"Annuaire entreprises, formalités, accompagnement, données économiques 80",Gratuit,Hauts-de-France,Annuaire
CMA Hauts-de-France,https://www.cma-hautsdefrance.fr,Chambre consulaire,Chambre de Métiers et de l'Artisanat des Hauts-de-France,"Annuaire artisans, accompagnement, apprentissage, données artisanat régional",Gratuit,Hauts-de-France,Annuaire
Hauts-de-France Innovation Développement,https://www.hautsdefrance-id.fr,Agence de développement,Agence régionale de développement et d'innovation des Hauts-de-France,"Implantation, filières, innovation, export, données économiques régionales",Gratuit,Hauts-de-France,Annuaire / Études / Rapports
MEL Économie (Lille),https://www.lillemetropole.fr/economie,Agence de développement,Développement économique de la Métropole Européenne de Lille,"Implantation, zones d'activité, filières, données territoire lillois",Gratuit,Hauts-de-France,Annuaire / Études / Rapports
French Tech Lille,https://lafrenchtech.com/fr/la-france-a-lechelon-local/lille,Écosystème startup,Communauté French Tech de Lille,"Annuaire startups, événements, e-commerce, retail tech, communauté",Gratuit,Hauts-de-France,Annuaire
EuraTechnologies,https://www.euratechnologies.com,Incubateur,Incubateur et accélérateur de startups numériques à Lille,"Annuaire startups résidentes, programmes, événements, coworking",Gratuit,Hauts-de-France,Annuaire
Pôle i-Trans,https://www.i-trans.org,Pôle de compétitivité,Pôle de compétitivité ferroviaire et mobilités (Valenciennes),"Annuaire membres, projets R&D ferroviaire, mobilité, logistique",Gratuit,Hauts-de-France,Annuaire
Pôle IAR (Industries & Agro-Ressources),https://www.iar-pole.com,Pôle de compétitivité,Pôle de compétitivité bioéconomie et bioraffinerie (Laon),"Annuaire membres, projets bioéconomie, chimie verte, agroressources",Gratuit,Hauts-de-France,Annuaire
Up-tex,https://www.up-tex.fr,Pôle de compétitivité,Pôle de compétitivité textile du Nord,"Annuaire membres, textiles techniques, innovation textile, mode",Gratuit,Hauts-de-France,Annuaire
CRESS Hauts-de-France,https://www.cress-hdf.org,Réseau ESS,Chambre Régionale de l'Économie Sociale et Solidaire des Hauts-de-France,"Annuaire structures ESS, observatoire, emploi ESS, cartographie",Gratuit,Hauts-de-France,Annuaire
CCI Alsace Eurométropole,https://www.alsace-eurometropole.cci.fr,Chambre consulaire,CCI territoriale d'Alsace Eurométropole (Strasbourg),"Annuaire entreprises, formalités, accompagnement, données économiques 67/68",Gratuit,Grand Est,Annuaire
CCI Meurthe-et-Moselle,https://www.nancy.cci.fr,Chambre consulaire,CCI territoriale de Meurthe-et-Moselle (Nancy),"Annuaire entreprises, formalités, accompagnement, données économiques 54",Gratuit,Grand Est,Annuaire
CCI Moselle,https://www.moselle.cci.fr,Chambre consulaire,CCI territoriale de la Moselle (Metz),"Annuaire entreprises, formalités, accompagnement, données économiques 57",Gratuit,Grand Est,Annuaire
CCI Marne,https://www.marne.cci.fr,Chambre consulaire,CCI territoriale de la Marne (Reims/Châlons),"Annuaire entreprises, formalités, accompagnement, données économiques 51",Gratuit,Grand Est,Annuaire
CMA Grand Est,https://www.cma-grandest.fr,Chambre consulaire,Chambre de Métiers et de l'Artisanat du Grand Est,"Annuaire artisans, accompagnement, apprentissage, données artisanat régional",Gratuit,Grand Est,Annuaire
Grand E-Nov+,https://www.grandenov.fr,Agence de développement,Agence de développement et d'innovation du Grand Est,"Implantation, filières stratégiques, innovation, export, données économiques",Gratuit,Grand Est,Annuaire / Études / Rapports
ADIRA Alsace,https://www.adira.com,Agence de développement,Agence de développement économique d'Alsace,"Implantation, filières industrielles, zones d'activité, données Alsace",Gratuit,Grand Est,Annuaire / Études / Rapports
French Tech Strasbourg,https://lafrenchtech.com/fr/la-france-a-lechelon-local/strasbourg,Écosystème startup,Communauté French Tech de Strasbourg,"Annuaire startups, événements, programmes, communauté tech alsacienne",Gratuit,Grand Est,Annuaire
Pôle Fibres-Energivie,https://www.fibres-energivie.eu,Pôle de compétitivité,Pôle de compétitivité matériaux et construction durable (Alsace),"Annuaire membres, projets bâtiment durable, matériaux, efficacité énergétique",Gratuit,Grand Est,Annuaire
BioValley France,https://www.biovalley-france.com,Pôle de compétitivité,Pôle de compétitivité santé en Alsace,"Annuaire membres, projets R&D santé, pharma, biotech, medtech",Gratuit,Grand Est,Annuaire
Materalia,https://www.materalia.fr,Pôle de compétitivité,Pôle de compétitivité matériaux et procédés (Lorraine/Champagne),"Annuaire membres, projets métallurgie, fonderie, matériaux avancés",Gratuit,Grand Est,Annuaire
CRESS Grand Est,https://www.cress-grandest.org,Réseau ESS,Chambre Régionale de l'Économie Sociale et Solidaire du Grand Est,"Annuaire structures ESS, observatoire, emploi ESS, cartographie",Gratuit,Grand Est,Annuaire
CCI Rouen Métropole,https://www.rouen-metropole.cci.fr,Chambre consulaire,CCI territoriale de Rouen Métropole,"Annuaire entreprises, formalités, accompagnement, données économiques 76",Gratuit,Normandie,Annuaire
CCI Caen Normandie,https://www.caen.cci.fr,Chambre consulaire,CCI territoriale de Caen Normandie,"Annuaire entreprises, formalités, accompagnement, données économiques 14",Gratuit,Normandie,Annuaire
CCI Eure,https://www.eure.cci.fr,Chambre consulaire,CCI territoriale de l'Eure,"Annuaire entreprises, formalités, accompagnement, données économiques 27",Gratuit,Normandie,Annuaire
CMA Normandie,https://www.cma-normandie.fr,Chambre consulaire,Chambre de Métiers et de l'Artisanat de Normandie,"Annuaire artisans, accompagnement, apprentissage, données artisanat régional",Gratuit,Normandie,Annuaire
AD Normandie,https://www.adnormandie.fr,Agence de développement,Agence de Développement pour la Normandie,"Implantation, filières énergie/mer/aéro/agri, innovation, données économiques",Gratuit,Normandie,Annuaire / Études / Rapports
Normandie Incubation,https://normandie-incubation.com,Incubateur,Incubateur régional de Normandie pour les projets innovants,"Annuaire startups incubées, programmes, accompagnement, projets R&D",Gratuit,Normandie,Annuaire
French Tech Rouen Normandie,https://lafrenchtech.com/fr/la-france-a-lechelon-local/rouen-normandie,Écosystème startup,Communauté French Tech de Rouen Normandie,"Annuaire startups, événements, programmes, communauté tech normande",Gratuit,Normandie,Annuaire
Pôle TES (Transactions Électroniques Sécurisées),https://www.pole-tes.com,Pôle de compétitivité,Pôle de compétitivité des transactions électroniques sécurisées (Caen),"Annuaire membres, projets cybersécurité, identité numérique, paiement",Gratuit,Normandie,Annuaire
Pôle Hippolia,https://www.pole-hippolia.org,Pôle de compétitivité,Pôle de compétitivité de la filière équine (Normandie),"Annuaire membres, projets filière cheval, santé équine, sport, élevage",Gratuit,Normandie,Annuaire
CRESS Normandie,https://www.cressnormandie.org,Réseau ESS,Chambre Régionale de l'Économie Sociale et Solidaire de Normandie,"Annuaire structures ESS, observatoire, emploi ESS, cartographie",Gratuit,Normandie,Annuaire
CCI Marseille-Provence,https://www.ccimp.com,Chambre consulaire,CCI territoriale de Marseille Provence,"Annuaire entreprises, formalités, accompagnement, données économiques 13",Gratuit,Provence-Alpes-Côte d'Azur,Annuaire
CCI Nice Côte d'Azur,https://www.cote-azur.cci.fr,Chambre consulaire,CCI territoriale de Nice Côte d'Azur,"Annuaire entreprises, formalités, accompagnement, données économiques 06",Gratuit,Provence-Alpes-Côte d'Azur,Annuaire
CCI Var,https://www.var.cci.fr,Chambre consulaire,CCI territoriale du Var (Toulon),"Annuaire entreprises, formalités, accompagnement, données économiques 83",Gratuit,Provence-Alpes-Côte d'Azur,Annuaire
CCI Vaucluse,https://www.vaucluse.cci.fr,Chambre consulaire,CCI territoriale du Vaucluse (Avignon),"Annuaire entreprises, formalités, accompagnement, données économiques 84",Gratuit,Provence-Alpes-Côte d'Azur,Annuaire
CMA Provence-Alpes-Côte d'Azur,https://www.cma-paca.fr,Chambre consulaire,Chambre de Métiers et de l'Artisanat de PACA,"Annuaire artisans, accompagnement, apprentissage, données artisanat régional",Gratuit,Provence-Alpes-Côte d'Azur,Annuaire
Rising Sud,https://www.risingsud.fr,Agence de développement,Agence de développement économique de la Région Sud PACA,"Implantation, filières aéro/mer/numérique/santé, innovation, données éco",Gratuit,Provence-Alpes-Côte d'Azur,Annuaire / Études / Rapports
Aix-Marseille French Tech,https://lafrenchtech.com/fr/la-france-a-lechelon-local/aix-marseille,Écosystème startup,Communauté French Tech d'Aix-Marseille,"Annuaire startups, événements, programmes, communauté tech marseillaise",Gratuit,Provence-Alpes-Côte d'Azur,Annuaire
French Tech Côte d'Azur,https://lafrenchtech.com/fr/la-france-a-lechelon-local/cote-dazur,Écosystème startup,Communauté French Tech de Nice Côte d'Azur,"Annuaire startups, événements, Smart City, tourisme tech",Gratuit,Provence-Alpes-Côte d'Azur,Annuaire
Pôle Mer Méditerranée,https://www.polemermediterranee.com,Pôle de compétitivité,Pôle de compétitivité des activités maritimes en Méditerranée,"Annuaire membres, projets naval, offshore, environnement marin",Gratuit,Provence-Alpes-Côte d'Azur,Annuaire
Pôle SCS (Solutions Communicantes Sécurisées),https://www.pole-scs.org,Pôle de compétitivité,Pôle de compétitivité microélectronique et numérique sécurisé (Sophia Antipolis),"Annuaire membres, projets IoT, 5G, IA, cybersécurité",Gratuit,Provence-Alpes-Côte d'Azur,Annuaire
Capenergies,https://www.capenergies.fr,Pôle de compétitivité,Pôle de compétitivité des énergies non génératrices de gaz à effet de serre,"Annuaire membres, projets nucléaire, ENR, hydrogène, stockage",Gratuit,Provence-Alpes-Côte d'Azur,Annuaire
SAFE Cluster,https://www.safecluster.com,Pôle de compétitivité,Pôle de compétitivité aéronautique et sécurité en PACA,"Annuaire membres, projets aéro, défense, sécurité, spatial",Gratuit,Provence-Alpes-Côte d'Azur,Annuaire
CRESS PACA,https://www.cresspaca.org,Réseau ESS,Chambre Régionale de l'Économie Sociale et Solidaire de PACA,"Annuaire structures ESS, observatoire, emploi ESS, cartographie",Gratuit,Provence-Alpes-Côte d'Azur,Annuaire
Sophia Antipolis,https://www.sophia-antipolis.fr,Technopole,Première technopole européenne - sciences et technologies (Nice),"Annuaire 2500+ entreprises, telecoms, IA, santé, R&D, startups",Gratuit,Provence-Alpes-Côte d'Azur,Annuaire
CCI Côte-d'Or Dijon Métropole,https://www.cotedor.cci.fr,Chambre consulaire,CCI territoriale de Côte-d'Or Dijon Métropole,"Annuaire entreprises, formalités, accompagnement, données économiques 21",Gratuit,Bourgogne-Franche-Comté,Annuaire
CCI Doubs,https://www.doubs.cci.fr,Chambre consulaire,CCI territoriale du Doubs (Besançon),"Annuaire entreprises, formalités, accompagnement, données économiques 25",Gratuit,Bourgogne-Franche-Comté,Annuaire
CCI Saône-et-Loire,https://www.saoneetloire.cci.fr,Chambre consulaire,CCI territoriale de Saône-et-Loire,"Annuaire entreprises, formalités, accompagnement, données économiques 71",Gratuit,Bourgogne-Franche-Comté,Annuaire
CCI Yonne,https://www.yonne.cci.fr,Chambre consulaire,CCI territoriale de l'Yonne (Auxerre),"Annuaire entreprises, formalités, accompagnement, données économiques 89",Gratuit,Bourgogne-Franche-Comté,Annuaire
CMA Bourgogne-Franche-Comté,https://www.cma-bfc.fr,Chambre consulaire,Chambre de Métiers et de l'Artisanat de Bourgogne-Franche-Comté,"Annuaire artisans, accompagnement, apprentissage, données artisanat régional",Gratuit,Bourgogne-Franche-Comté,Annuaire
AER BFC,https://www.aer-bfc.com,Agence de développement,Agence Économique Régionale de Bourgogne-Franche-Comté,"Implantation, filières auto/agroalimentaire/luxe, innovation, export, données éco",Gratuit,Bourgogne-Franche-Comté,Annuaire / Études / Rapports
French Tech Dijon,https://lafrenchtech.com/fr/la-france-a-lechelon-local/dijon,Écosystème startup,Communauté French Tech de Dijon Bourgogne,"Annuaire startups, événements, AgriTech, FoodTech, communauté",Gratuit,Bourgogne-Franche-Comté,Annuaire
Vitagora,https://www.vitagora.com,Pôle de compétitivité,Pôle de compétitivité goût-nutrition-santé (Dijon),"Annuaire membres, projets agroalimentaire, nutrition, innovation alimentaire",Gratuit,Bourgogne-Franche-Comté,Annuaire
Pôle Véhicule du Futur,https://www.vehiculedufutur.com,Pôle de compétitivité,Pôle de compétitivité véhicules et mobilités du futur (BFC/Grand Est),"Annuaire membres, projets véhicule électrique, hydrogène, autonome",Gratuit,Bourgogne-Franche-Comté,Annuaire
Microtechniques (TEMIS),https://www.temis.org,Technopole,Technopole des microtechniques de Besançon,"Annuaire entreprises micro/nanotech, horlogerie, medtech, luxe",Gratuit,Bourgogne-Franche-Comté,Annuaire
CRESS BFC,https://www.cress-bfc.org,Réseau ESS,Chambre Régionale de l'Économie Sociale et Solidaire de BFC,"Annuaire structures ESS, observatoire, emploi ESS, cartographie",Gratuit,Bourgogne-Franche-Comté,Annuaire
CCI Ajaccio,https://www.2a.cci.fr,Chambre consulaire,CCI territoriale d'Ajaccio et de la Corse-du-Sud,"Annuaire entreprises, formalités, accompagnement, données économiques 2A",Gratuit,Corse,Annuaire
CCI Bastia Haute-Corse,https://www.2b.cci.fr,Chambre consulaire,CCI territoriale de Bastia et de Haute-Corse,"Annuaire entreprises, formalités, accompagnement, données économiques 2B",Gratuit,Corse,ESG / RSE
